<?xml version="1.0" encoding="utf-8" standalone="no"?>
<!DOCTYPE HTML PUBLIC  "-//W3C//DTD HTML 4.0 Transitional//EN" "Server.dtd"> 
<server>
	<port value="4000"/>
	<agent class="jus.aor.mobilagent.agent.LookForHotel" codebase="jar/LookForHotel.jar" args="Paris">
		<etape server="mobilagent://localhost:4001/" action="doHotel" />
		<etape server="mobilagent://localhost:4002/" action="doHotel" />
		<etape server="mobilagent://localhost:4003/" action="doHotel" />
		<etape server="mobilagent://localhost:4004/" action="doHotel" />
		<etape server="mobilagent://localhost:4005/" action="doAnnuaire"/>
	</agent>
</server>

